{
  "$schema": "../../schemas/feature.schema.json",
  "name": "jdrift",
  "description": "Lists what changed upstream in the files taken from pstack.",
  "packages": [
    "src/jdrift"
  ],
  "commands": {
    "jdrift": "jdrift.cli:main"
  },
  "docs": [
    "docs/jdrift.md"
  ],
  "owns": [
    "src/jdrift/**",
    "docs/jdrift.md",
    "docs/jstack-explained.html",
    "tests/test_drift.py",
    "tests/test_jstack_explained.py",
    "tests/fixtures/pstack-names.txt",
    ".claude/skills/verify-jstack/features/jdrift.md"
  ]
}
