{
  "$schema": "../../schemas/feature.schema.json",
  "name": "jroles",
  "description": "Picks the model for a role from the role map.",
  "packages": [
    "src/jroles"
  ],
  "commands": {
    "jroles": "jroles.cli:main"
  },
  "units": [
    "units/jroles-mirror.service",
    "units/jroles-mirror.timer"
  ],
  "docs": [
    "docs/jroles.md"
  ]
}
