{
  "$schema": "../../schemas/feature.schema.json",
  "name": "jinstall",
  "description": "Installs, checks and removes jstack on a machine: install.sh in a checkout, and the jinstall command from a release.",
  "packages": [
    "src/jinstall"
  ],
  "commands": {
    "jinstall": "jinstall.cli:main"
  },
  "docs": [
    "docs/jinstall.md"
  ]
}
