{
  "$schema": "../../schemas/feature.schema.json",
  "name": "jbus",
  "description": "Does a home's routine work from a timer, so a repo can run with no home thread.",
  "packages": [
    "features/jbus/src/jbus"
  ],
  "commands": {
    "jbus": "jbus.cli:main"
  },
  "units": [
    "units/jbus-ci.service",
    "units/jbus-ci.timer",
    "units/jbus-failed.service",
    "units/jbus-relay.service",
    "units/jbus-snapshot-failed.service",
    "units/jbus-snapshot.service",
    "units/jbus-snapshot.timer",
    "units/jbus-stale.service",
    "units/jbus-stale.timer",
    "units/jbus-view.service",
    "units/jbus.service",
    "units/jbus.timer"
  ],
  "docs": [
    "features/jbus/docs/jbus.md",
    "features/jbus/docs/chef.md"
  ],
  "owns": [
    ".cursor/skills/verify-main-red/SKILL.md"
  ]
}
